{"schemaVersion":1,"policyVersion":"solver-v1","featureHash":"aaaaaaaaaaaaaaaaaaaaaaaaaaaaaaaaaaaaaaaaaaaaaaaaaaaaaaaaaaaaaaaa","route":"direct","plannedPhases":["intake","implement","verify"],"context":{"recommendation":"targeted","budgetBand":"small"},"toolGroups":["intake","task"],"helper":{"needed":false,"role":null,"enforced":false},"parentModel":{"provider":"openai-codex","modelId":"gpt-5.6-terra","effort":"medium","enforced":false},"reasonCodes":["explicit-path"],"confidence":"high","mode":"shadow","override":{"observed":false,"route":null,"recordedAt":null}}
